{"axis_counts":[{"axis":"category_cardinality","value_counts":[{"case_count":38,"value":"single"},{"case_count":62,"value":"multiple"}]},{"axis":"category_text_alignment","value_counts":[{"case_count":85,"value":"strong"},{"case_count":15,"value":"weak"}]},{"axis":"cause_explicitness","value_counts":[{"case_count":60,"value":"explicit"},{"case_count":40,"value":"unknown"}]},{"axis":"emotion_cardinality","value_counts":[{"case_count":20,"value":"single"},{"case_count":73,"value":"multiple"},{"case_count":7,"value":"self_insight_only"}]},{"axis":"emotion_strength_shape","value_counts":[{"case_count":33,"value":"single_strength"},{"case_count":60,"value":"mixed_strength"},{"case_count":7,"value":"self_insight_medium"}]},{"axis":"expected_depth_range","value_counts":[{"case_count":11,"value":"minimal"},{"case_count":84,"value":"focused"},{"case_count":56,"value":"layered"}]},{"axis":"families","value_counts":[{"case_count":6,"value":"low_information_short"},{"case_count":7,"value":"limited_grounding"},{"case_count":10,"value":"daily_unpleasant"},{"case_count":10,"value":"daily_positive"},{"case_count":8,"value":"self_denial"},{"case_count":12,"value":"anger_or_boundary"},{"case_count":14,"value":"uncertainty_support"},{"case_count":9,"value":"standard_state_answer"},{"case_count":7,"value":"structure_question"},{"case_count":8,"value":"long_meaning_arc"},{"case_count":8,"value":"relationship_gratitude_recovery"},{"case_count":10,"value":"change_future_intention_transition"},{"case_count":6,"value":"source_unavailable_high_information"},{"case_count":6,"value":"history_eligible_current_input_only"}]},{"axis":"input_field_presence","value_counts":[{"case_count":14,"value":"thought_only"},{"case_count":7,"value":"action_only"},{"case_count":79,"value":"both"}]},{"axis":"intention_state","value_counts":[{"case_count":16,"value":"none"},{"case_count":22,"value":"explicit"},{"case_count":9,"value":"uncertain"},{"case_count":53,"value":"completed"}]},{"axis":"length_class","value_counts":[{"case_count":12,"value":"short"},{"case_count":49,"value":"medium"},{"case_count":31,"value":"long"},{"case_count":8,"value":"very_long"}]},{"axis":"question_system_relevance","value_counts":[{"case_count":40,"value":"not_needed"},{"case_count":23,"value":"possible"},{"case_count":18,"value":"burden_risk"},{"case_count":19,"value":"future_refined_candidate"}]},{"axis":"referent_clarity","value_counts":[{"case_count":66,"value":"clear"},{"case_count":13,"value":"multiple_candidates"},{"case_count":21,"value":"omitted"}]},{"axis":"structural_variation.merge_split_eligible","value_counts":[{"case_count":26,"value":"false"},{"case_count":74,"value":"true"}]},{"axis":"structural_variation.minimal_single_structure_expected","value_counts":[{"case_count":92,"value":"false"},{"case_count":8,"value":"true"}]},{"axis":"structural_variation.order_variation_eligible","value_counts":[{"case_count":17,"value":"false"},{"case_count":83,"value":"true"}]},{"axis":"structural_variation.reception_position_variation_eligible","value_counts":[{"case_count":14,"value":"false"},{"case_count":86,"value":"true"}]},{"axis":"surface_shape","value_counts":[{"case_count":79,"value":"complete_sentence"},{"case_count":1,"value":"fragment"},{"case_count":9,"value":"colloquial"},{"case_count":5,"value":"colloquial_fragment"},{"case_count":2,"value":"typo_or_orthographic_variation"},{"case_count":4,"value":"truncated"}]},{"axis":"temporal_scope","value_counts":[{"case_count":18,"value":"past"},{"case_count":25,"value":"current"},{"case_count":9,"value":"future_intention"},{"case_count":48,"value":"mixed"}]},{"axis":"thought_action_relation","value_counts":[{"case_count":21,"value":"not_applicable"},{"case_count":3,"value":"same"},{"case_count":50,"value":"complement"},{"case_count":7,"value":"contrast"},{"case_count":14,"value":"time_shift"},{"case_count":5,"value":"cause_unknown"}]},{"axis":"topic_cardinality","value_counts":[{"case_count":77,"value":"single"},{"case_count":23,"value":"multiple"}]},{"axis":"valence","value_counts":[{"case_count":14,"value":"positive"},{"case_count":25,"value":"negative"},{"case_count":41,"value":"mixed"},{"case_count":11,"value":"neutral"},{"case_count":9,"value":"self_denial_adjacent"}]}],"batch_id":"nls3_batch_001","body_free":true,"case_count":100,"matrix_id":"nls3cov_36b473e97779e7ee","sample_schema_sha256":"90d569460f05aa7347145ba1562754c1304fe4b4878165b5bfbb1180cf9087ef","schema_version":"cocolon.emlis.nls_v3.coverage_matrix.v1","source_case_set_commitment":"35249591e6116564dcb92c7689baaff9a4b1a4a5992a1c7dfdfc04dd94a1e560"}
